title,link,citations,bioproject_id
Genomic and Bioinformatic Resources for Perennial Fruit Species,https://www.benthamdirect.com/content/journals/cg/10.2174/1389202923666220428102632,1,PRJNA318855
Genomic analysis provides insights into the origin and divergence of fruit flavor and flesh color of pummelo,https://nph.onlinelibrary.wiley.com/doi/abs/10.1111/nph.20223,5,PRJNA318855
The high-quality genome of pummelo provides insights into the tissue-specific regulation of citric acid and anthocyanin during domestication,https://academic.oup.com/hr/article-abstract/doi/10.1093/hr/uhac175/6655783,24,PRJNA318855
MỤC LỤC–CONTENTS,https://www.researchgate.net/profile/Ha-Chu-4/publication/342003684_PHAN_TICH_CAU_TRUC_VA_KHAI_THAC_DU_LIEU_BIEU_HIEN_CUA_HO_GENE_MA_HOA_NHAN_TO_PHIEN_MA_TCP_O_CAY_BUOI_Citrus_grandis/links/5eddfb1b299bf1d20bd86893/PHAN-TICH-CAU-TRUC-VA-KHAI-THAC-DU-LIEU-BIEU-HIEN-CUA-HO-GENE-MA-HOA-NHAN-TO-PHIEN-MA-TCP-O-CAY-BUOI-Citrus-grandis.pdf,0,PRJNA318855
"Genomic analyses of primitive, wild and cultivated citrus provide insights into asexual reproduction",https://www.nature.com/articles/ng.3839,461,PRJNA318855
