title,link,citations,bioproject_id
Colletotrichum falcatum infection influences the abundance of sucrose transporters and disease resistant proteins in sugarcane stalk,https://link.springer.com/article/10.1007/s13562-024-00899-9,9,PRJNA383616
"Colletotrichum falcatum influences sucrose accumulation in sugarcane stalks by modulating the expression of SPS, SPP, SuSy, and invertases",https://www.sciencedirect.com/science/article/pii/S0885576524000213,12,PRJNA383616
Techniques Used for the Identification of Defense-related Protein in Sugarcane in Response to Biotic Stress,https://www.taylorfrancis.com/chapters/edit/10.1201/9781003292425-9/techniques-used-identification-defense-related-protein-sugarcane-response-biotic-stress-smriti-mall,1,PRJNA383616
9 Techniques Used for the,https://books.google.com/books?hl=en&lr=&id=lKAIEQAAQBAJ&oi=fnd&pg=PA173&dq=PRJNA383616&ots=uZnn_TAa0g&sig=QGgSJ3loELNKSbTVLQ5hp8OFsNw,0,PRJNA383616
Catalases are induced during fungal infections in sugarcane to instigate the defense responses during red rot and wilt disease,https://link.springer.com/article/10.1007/s10343-024-01084-7,5,PRJNA383616
