title,link,citations,bioproject_id
Genomics of the origin and evolution of Citrus,https://www.nature.com/articles/nature25447,890,PRJNA414519
The haplotype-resolved genome assembly of an ancient citrus variety provides insights into the domestication history and fruit trait formation of loose-skin mandarins,https://link.springer.com/article/10.1186/s13059-025-03535-4,1,PRJNA414519
Comparative transcriptomics of wild and commercial Citrus during early ripening reveals how domestication shaped fruit gene expression,https://link.springer.com/article/10.1186/s12870-022-03509-9,19,PRJNA414519
Toward development of climate-resilient citrus,https://link.springer.com/chapter/10.1007/978-3-319-97946-5_5,4,PRJNA414519
Mapping and exploiting the citrus genome,https://api.taylorfrancis.com/content/chapters/edit/download?identifierName=doi&identifierValue=10.1201/9780429266638-1&type=chapterpdf,3,PRJNA414519
